{
  "schema": "sauti.action_envelope",
  "schema_version": "1.0.0",
  "action_id": "42424242-1234-4abc-8123-abcdefabcdef",
  "tenant_id": "demo-owner-001",
  "kind": "send_message",
  "created_at": "2026-10-03T20:00:00Z",
  "valid_until": "2026-10-04T20:00:00Z",
  "fact_revision": 1,
  "recipient": {
    "channel": "simulated",
    "address": "SIMULATED:guest-001",
    "language": "sw"
  },
  "payload": {
    "type": "message",
    "body": "Asante kwa kututembelea. Ni sehemu gani ya maelekezo iliyokuwa ngumu?",
    "body_language": "sw",
    "in_reply_to": "synthetic-review-001",
    "template_id": "ask_which_direction_step"
  },
  "evidence": [
    {
      "source_id": "synthetic-review-001",
      "content_hash": "186045d04f93118af6aba9ff5805cdf0e948bba2fd1d8600e157e594923d2daa",
      "span": {
        "start": 34,
        "end": 69
      },
      "quote": "maelekezo ya kufika yalikuwa magumu"
    }
  ],
  "preview": {
    "text": "SIMULATED tu. Tuma ujumbe huu kwa mgeni 001: Asante kwa kututembelea. Ni sehemu gani ya maelekezo iliyokuwa ngumu? (Haujakaguliwa na mzungumzaji wa Kiswahili.)",
    "render_locale": "sw-KE"
  },
  "authority": {
    "level": "owner",
    "owner_context_required": true
  },
  "digest": "b44ea066fa95208d81bb0934909294a4fac2caf7f84acdfc372f5a893a897ec8"
}
