{
  "schema": "sauti.action_envelope",
  "schema_version": "1.0.0",
  "action_id": "7a7a7a7a-5678-4def-9abc-0123456789ab",
  "tenant_id": "demo-owner-001",
  "kind": "record_payment",
  "created_at": "2026-10-03T20:05:00Z",
  "valid_until": "2026-10-03T21:05:00Z",
  "fact_revision": 1,
  "recipient": {
    "channel": "local",
    "address": "owner",
    "language": "sw"
  },
  "payload": {
    "type": "record_payment",
    "booking_id": "synthetic-booking-001",
    "money": {
      "amount_minor": 200000,
      "currency": "KES",
      "exponent": 2
    },
    "method": "mpesa",
    "reported_by": "owner"
  },
  "evidence": [],
  "preview": {
    "text": "Thomas, ziara Jumamosi tarehe nne Oktoba, watu wawili. Niandike malipo ya shilingi elfu mbili? (Later phase fixture.)",
    "render_locale": "sw-KE"
  },
  "authority": {
    "level": "owner",
    "owner_context_required": true
  },
  "digest": "5c3f8baf3a403f382ad1706722dfb8c0f8ff58c366fd5f9811b7281c7a0f886b"
}
